{
  "claimId": "SCH-2026-00103",
  "meta": {
    "contractVersion": "1.0.0",
    "createdAt": "2026-11-05T09:47:00Z",
    "currentStage": 4,
    "testCase": "Ablehnungskandidat"
  },
  "trace": [
    {
      "stage": 1,
      "at": "2026-11-05T10:02:00Z",
      "action": "erfasst",
      "note": "Anspruchsteller ist der Versicherungsnehmer selbst."
    },
    {
      "stage": 2,
      "at": "2026-11-05T14:45:00Z",
      "action": "geprüft",
      "note": "Keine Deckung: Eigenschaden."
    },
    {
      "stage": 3,
      "at": "2026-11-05T15:10:00Z",
      "action": "bewertet",
      "note": "Keine Bewertung, weil keine Deckung besteht."
    }
  ],
  "stage1": {
    "completedAt": "2026-11-05T10:02:00Z",
    "policyNumber": "GH-4712390",
    "incidentDate": "2026-10-28",
    "reportedAt": "2026-11-05T09:47:00Z",
    "damageType": "Sachschaden",
    "description": "Durch einen Rohrbruch im Keller ist Wasser in die vom Eigentümer selbst genutzte Einliegerwohnung gelaufen. Parkett und Küche sind beschädigt.",
    "claimant": {
      "name": "Hausverwaltung Kramer & Söhne GbR"
    },
    "claimedAmount": 8900.0
  },
  "stage2": {
    "completedAt": "2026-11-05T14:45:00Z",
    "coverageDecision": "nicht gedeckt",
    "reasoning": "Der Schaden betrifft die vom Versicherungsnehmer selbst genutzte Wohnung. Die Gebäudehaftpflicht deckt nur Schäden Dritter."
  },
  "stage3": {
    "completedAt": "2026-11-05T15:10:00Z",
    "assessedAmount": 0.0
  }
}
